{
	"id": "POI_Air-Quality-Station-24030-081",
	"type": "PointOfInterest",
	"name": "NICE OUEST BOTANIQUE",
	"category": ["Valeur correspondant Ã  AirQualityStation dans le dictionnaire"],
	"location": {
		"type": "Point",
		"coordinates": [
			"+0071240.09",
			"+433927.89"
			]
	},
	"refSeeAlso":["Air-Quality-Station-24030-081"],
	"source": "http://datasource"
}